[
  {
    "id": "module-public",
    "module_id": "module-public",
    "title": "公域获客",
    "module_code": "public",
    "module_type": "cbm",
    "space_id": "space-federation-root",
    "status": "active",
    "owner_subject_id": "subject-hay2045",
    "ai_subject_id": "subject-agent-public",
    "kpi_hint": "流量、触达、线索输入",
    "source_ref": "generated://module/public",
    "confidence": 0.95,
    "updated_at": "2026-03-11T19:39:02+08:00"
  },
  {
    "id": "module-private",
    "module_id": "module-private",
    "title": "私域转化",
    "module_code": "private",
    "module_type": "cbm",
    "space_id": "space-federation-root",
    "status": "active",
    "owner_subject_id": "subject-hay2045",
    "ai_subject_id": "subject-agent-private",
    "kpi_hint": "线索状态、转化节奏、复购机会",
    "source_ref": "generated://module/private",
    "confidence": 0.95,
    "updated_at": "2026-03-11T19:39:02+08:00"
  },
  {
    "id": "module-sales",
    "module_id": "module-sales",
    "title": "销售成交",
    "module_code": "sales",
    "module_type": "cbm",
    "space_id": "space-federation-root",
    "status": "active",
    "owner_subject_id": "subject-collab-owner",
    "ai_subject_id": "subject-agent-sales",
    "kpi_hint": "商机推进、报价、成交额",
    "source_ref": "generated://module/sales",
    "confidence": 0.94,
    "updated_at": "2026-03-11T19:39:02+08:00"
  },
  {
    "id": "module-delivery",
    "module_id": "module-delivery",
    "title": "产品交付",
    "module_code": "delivery",
    "module_type": "cbm",
    "space_id": "space-federation-root",
    "status": "active",
    "owner_subject_id": "subject-collab-owner",
    "ai_subject_id": "subject-agent-delivery",
    "kpi_hint": "交付节奏、里程碑、满意度",
    "source_ref": "generated://module/delivery",
    "confidence": 0.94,
    "updated_at": "2026-03-11T19:39:02+08:00"
  },
  {
    "id": "module-finance",
    "module_id": "module-finance",
    "title": "财务经营",
    "module_code": "finance",
    "module_type": "cbm",
    "space_id": "space-federation-root",
    "status": "active",
    "owner_subject_id": "subject-collab-owner",
    "ai_subject_id": "subject-agent-finance",
    "kpi_hint": "回款、利润、现金流",
    "source_ref": "generated://module/finance",
    "confidence": 0.94,
    "updated_at": "2026-03-11T19:39:02+08:00"
  },
  {
    "id": "module-governance",
    "module_id": "module-governance",
    "title": "治理控制",
    "module_code": "governance",
    "module_type": "cbm",
    "space_id": "space-federation-root",
    "status": "active",
    "owner_subject_id": "subject-hay2045",
    "ai_subject_id": "subject-agent-governance",
    "kpi_hint": "闭环率、失真率、复制进度",
    "source_ref": "generated://module/governance",
    "confidence": 0.97,
    "updated_at": "2026-03-11T19:39:02+08:00"
  }
]
